{
  "grant_type": "urn:ietf:params:oauth:grant-type:jwt-bearer",
  "client_id": "https://buyer-agent.example/client.json",
  "client_assertion_type": "urn:ietf:params:oauth:client-assertion-type:jwt-bearer",
  "client_assertion": "eyJhbGciOiJFUzI1NiIsInR5cCI6IkpXVCIsImtpZCI6ImV4YW1wbGUtaWRlbnRpdHkta2V5In0.eyJpc3MiOiJodHRwczovL2J1eWVyLWFnZW50LmV4YW1wbGUvY2xpZW50Lmpzb24iLCJzdWIiOiJodHRwczovL2J1eWVyLWFnZW50LmV4YW1wbGUvY2xpZW50Lmpzb24iLCJhdWQiOiJodHRwczovL2RlbW8tdG95b3RhLmV4YW1wbGUuY29tL3BvcHB5IiwiaWF0IjoxNzkyNzQyNDAwLCJleHAiOjE3OTI3NDI0NjAsImp0aSI6ImZhNGViYzgyYjk1OGE1Y2Q3NWRhOTliMDMxYTNjNjQ3In0.example-signature-not-valid",
  "assertion": "eyJhbGciOiJFUzI1NiIsInR5cCI6IkpXVCIsImtpZCI6ImV4YW1wbGUtaWRlbnRpdHkta2V5In0.eyJpc3MiOiJodHRwczovL2J1eWVyLWFnZW50LmV4YW1wbGUvY2xpZW50Lmpzb24iLCJzdWIiOiJ1c3JfNmQ3MTZiODMzYWI1NDUxZjg0MGUwODZlNDA2Yzk0OWMiLCJhdWQiOiJodHRwczovL2RlbW8tdG95b3RhLmV4YW1wbGUuY29tL3BvcHB5IiwiaWF0IjoxNzkyNzQyNDAwLCJleHAiOjE3OTI3NDI0NjAsImp0aSI6ImMwZDIyNmIzYjc3ZDU1N2IzODA0NGFhMjdmYmY0OTdjIn0.example-signature-not-valid",
  "resource": "https://demo-toyota.example.com/poppy"
}
